Response number,Speaker,Content
764,SOMEONE IN THE CROWD,(shouting) Take the hill!
765,RENNIE,Shit.
766,JERRY,Oh fuck. 92.
767,RENNIE,(to the protestors) Stop running!
768,JERRY,(to the protestors) Stop running! Slow down!
769,POLICEMAN,There are no permits for this demonstration! You are ordered to leave the park immediately! There are no permits for this demonstration! You are ordered to leave the park immediately!
770,ABBIE,"The street name for chloroacetophenone is tear gas and it's a fuckin' blow torch--your lungs, your skin, your eyes...Riot clubs? They're made out of the same wood they use for baseball bats."
771,FRAT BOY #1,"I told you to put that flag down, go in the kitchen and make me a fuckin' sandwich! 93."
772,JERRY,Hey! What are you doin?! Get the fuck offa her! What the fuck is the matter with you?!
773,JERRY,Get the fuck offa her!
774,FRAT BOY #2,"Fuck you, hippie faggot!"
775,JERRY,You're alright. You're okay.
776,JERRY,Here. You're okay.
777,JERRY,You need to hold this over your face and I'll get you outa here.
778,POLICEMAN,"Don't move, Jerry."
779,JERRY,"Get those guys, they were--"
780,POLICEMAN,You're under arrest.
781,KUNSTLER,"After bailing Tom Hayden out, Abbie, Dave and Tom returned to the park, is that correct?"
782,TOM,"I'll be honest, I'm starting to worry about getting everyone out of Chicago alive."
783,ABBIE,That's not really up to us.
784,TOM,Yeah it is.
785,ABBIE,What are you lookin' at me for? I went to bail you out of jail.
786,TOM,(pause) Eight-hundred people followed you!
787,ABBIE,"Oh that. Yeah, people follow me, fuck if I know why?"
788,TOM,I'm wracking my brain as well. 95.
789,RENNIE,(to JERRY) How'd you make bail so fast?
790,JERRY,"I wasn't arrested, I was detained. They couldn't figure out what to charge me with."
791,DAVE,Assault.
792,JERRY,I was assaulting someone who was assaulting someone.
793,DAPHNE,Guys. Nothing's more dangerous than a crowd of people who are moving. It's like trying to re-direct the Mississippi River.
794,JERRY,Isn't she great?
795,TOM,(to ABBIE) Get your people to cool off. We're responsible for these people.
796,ABBIE,"We have to protest in front of the convention, Tommy, plain and simple. 'Cause that's where the cameras are. We have to get to the convention. And that means we have to leave the park. And that's when people'll get hurt. As long as every person following me knows that, I sleep fine at night."
797,TOM,Well you should tell me how you do it.
798,ABBIE,A lot of it's drugs.
799,TOM,Yeah.
800,TOM,That's what happened when we tried to go up a hill. We're not getting anywhere near the convention.
801,KUNSTLER,"Special Agent O'Connor, you testified that Jerry Rubin said, ""Fuck 'em all. They're all pigs. We should form an army and get guns.”"
802,DAPHNE,Yes.
803,KUNSTLER,"And when he said that, did anyone form an army and get guns?"
804,DAPHNE,No.
805,KUNSTLER,Did Jerry Rubin instruct the crowd to run into the park?
806,DAPHNE,No.
807,KUNSTLER,Did Rennie Davis?
808,DAPHNE,No.
809,KUNSTLER,Was Abbie Hoffman even there?
810,DAPHNE,No.
811,KUNSTLER,Was Dave Dellinger?
812,DAPHNE,No. 97.
813,JUDGE HOFFMAN,We'll stand in recess until--
814,FRED,Four hours. That's how long Bobby Seale--
815,JUDGE HOFFMAN,Marshals.
816,FRED,--was in Chicago. Four hours.
817,JUDGE HOFFMAN,Court stands in recess for the weekend.
818,JERRY,I took in the exhibit. I cleared my mind. I stood there for twenty minutes and I felt nothing.
819,ABBIE,"Well...but it wasn't a painting, it was an exhibit. It was a natural history museum. 99."
820,JERRY,"And when you put exhibits of Native Indian families in a natural history museum alongside dioramas of early man and the Jurassic age, it gives the impression that the Cherokee evolved into modern day Europeans."
821,ABBIE,"Hey, look who it is!"
822,ABBIE,Should we say hi?
823,JERRY,I've got a bone to pick with that guy.
824,ABBIE,Hey counselor!
825,SCHULTZ,No colleges this weekend?
826,ABBIE,Winter break. My audiences went home to their parents. Are these ladies related to you?
827,SCHULTZ,These are my daughters Julie and Emily.
828,ABBIE,(to the girls) Your dad's a good guy. And that's coming from someone who he's been trying hard to put in federal prison.
829,SCHULTZ,We shouldn't be talking without your lawyer here.
830,ABBIE,"Nah, we're all on the same team. 100."
831,SCHULTZ,"In one sense I guess, but in a much truer sense we're not. (SCHULTZ takes a couple of dollars out of his pocket) Girls, take this dollar over to the musicians and put it in their hat. Then take this dollar and buy some of those candy-covered peanuts mom won't let you have."
832,ABBIE,Sweet kids.
833,SCHULTZ,'Cause if your lawyers were here I'd feel comfortable telling you that the window's closing for you to plead out.
834,JERRY,"Oh we're not takin' a fuckin' deal, would you stop? And I wish I could share Abbie's sentiment that you're a good guy, but I'm afraid I can't."
835,SCHULTZ,I'm sorry to hear that.
836,JERRY,Sending Daphne O'Connor to break my heart was way outa line.
837,SCHULTZ,Well I don't work for the FBI but Special Agent O'Connor was one of many agents sent to gather intelligence on what had been deemed a credible domestic threat.
838,JERRY,"Fine, then you bug our phones, you wire up a dope dealer, be a man. You don't send a woman to ensorcell me--it means ""enchanting”--only to have her crush my soul."
839,SCHULTZ,How long did you two know each other? 101.
840,JERRY,(calling) Does she ever mention me?
841,BERNADINE,(into phone) Conspiracy Office.
842,BERNADINE,"(to TOM) It's Bill. Something's happened, Tom."
843,KUNSTLER,"Bobby, Fred Hampton was shot and killed last night. There was a police raid and there was a shootout and he's dead."
844,KUNSTLER,(consulting notes) It happened between the hours of 4am and--
845,BOBBY,I know.
846,KUNSTLER,You were told?
847,BOBBY,Yeah.
848,KUNSTLER,I'm sorry.
849,BOBBY,"(pause) The seven of you, you've all got the same father, right? (to TOM) I'm talking to you. You've all got the same father, right? Cut your hair, don't be a fag, respect authority, respect America, respect me. Your life, it's fuck you to your father, right? A little?"
850,TOM,(beat) Maybe.
851,BOBBY,Maybe. And you can see how that's different from a rope on a tree?
852,TOM,Yeah.
853,BOBBY,Yeah. He was shot in the wrist first. You can't hold a gun if you've been shot in the wrist. You can't pull a trigger. The second shot was in the head. (MORE) 104.
854,BOBBY,Fred was executed. (pause) Anything else?
855,KUNSTLER,(pause) No.
856,SCHULTZ,"Detective, calling your attention to the evening of the next day, Tuesday, August 27th, were you in Grant Park on that day?"
857,FRAPOLY,"Yes. There was a ""Free Huey Newton” rally going on."
858,SCHULTZ,Did you recognize any of the speakers?
859,FRAPOLY,I heard Jerry Rubin give a speech. Phil Ochs sang and then Bobby Seale gave a speech.
860,BOBBY,I object to this man's testimony against me because I've been denied counsel.
861,JUDGE HOFFMAN,We understand.
862,SCHULTZ,Do you recall anything from Mr. Seale's speech?
863,FRAPOLY,Yes. He said-- 105.
864,BOBBY,I object to this man's--
865,JUDGE HOFFMAN,Quiet.
866,SCHULTZ,Go ahead.
867,FRAPOLY,May I refer to notes?
868,SCHULTZ,Yes sir.
869,FRAPOLY,"He said, ""We must understand that as we go forth to try to move the reprobate politicians--"
870,BOBBY,Your Honor--
871,FRAPOLY,"""--our cowardly Congress, the jive, double-lip talkin' Nixon--”"
872,BOBBY,"Jive double-lip talkin' Nixon? You make me sound like one funky cat, thank you sir."
873,JUDGE HOFFMAN,"Last warning, Mr. Seale."
874,SCHULTZ,Did he say anything else?
875,FRAPOLY,"He said, ""The revolution at this time is directly connected to organized guns and force.”"
876,SCHULTZ,No more questions.
877,BOBBY,"A jive, double-lip talkin', funky, funky cat. 106."
878,JUDGE HOFFMAN,Would the defense like to cross- examine the witness?
879,BOBBY,Yes. I'm sitting here saying that I would like to cross--
880,JUDGE HOFFMAN,Only lawyers can address a wit--
881,BOBBY,My lawyer is Charles Garry.
882,JUDGE HOFFMAN,I'm tired of hearing that.
883,BOBBY,I couldn't care less what you're tired of.
884,JUDGE HOFFMAN,What did you say?
885,BOBBY,I said it would be impossible for me to care any less what you're tired of and I demand to cross- examine this--
886,JUDGE HOFFMAN,Sit in your chair and be quiet and don't ever address the Court in that--
887,BOBBY,(to the crowd) It was premeditated murder. Fred Hampton was assassinated last night.
888,JUDGE HOFFMAN,"Marshals, put Mr. Seale in his seat."
889,BOBBY,He wouldn't have been able to hold a gun in his right hand. (MORE) 107.
890,BOBBY,"When they publish the coroner's report, make sure you ask about the bullet wound in his wrist."
891,JUDGE HOFFMAN,"I strongly caution you, Mr. Seale, I strongly caution you that--"
892,BOBBY,Oh strongly fuck yourself.
893,JUDGE HOFFMAN,"Marshals, take that defendant into a room and deal with him as he should be dealt with."
894,JUDGE HOFFMAN,"Let the record show that I tried, fairly and impartially, I tried to get the defendant to sit on his own. I ask you again, and you may indicate by raising your head up and down or moving it from side to side, if I have your assurance that you will not do anything to disrupt this trial if I allow you to resume proper order."
895,JUDGE HOFFMAN,Do I have your assurance?
896,JUDGE HOFFMAN,"Mr. Schultz, call your next witness."
897,JUDGE HOFFMAN,"Mr. Schultz, call your witness."
898,SCHULTZ,"May we approach, Your Honor?"
899,KUNSTLER,Can he breathe? (to BOBBY) Can you breathe alright?
900,SCHULTZ,"Your Honor, a defendant is bound and gagged in an American courtroom."
901,FORAN,He brought it on himself.
902,KUNSTLER,(to FORAN) Are you insane?
903,JUDGE HOFFMAN,That's enough.
904,KUNSTLER,This is an unholy disgrace to the law. This is a medieval torture chamber.
905,JUDGE HOFFMAN,I know no other lawyer who would utter such a thing.
906,WEINGLASS,This is an unholy disgrace to the law and a medieval torture--
907,JUDGE HOFFMAN,"I said that's enough! (beat) Love of God. (beat) What do you want, Mr. Schultz, this is your sidebar."
908,SCHULTZ,"Your Honor, at this time the Government would like to make a motion that Bobby Seale be separated--"
909,FORAN,Wait-- 110.
910,SCHULTZ,(to FORAN) Yes. Just--please sir. (to JUDGE HOFFMAN) --a motion that Bobby Seale be separated from the other defendants and that a mistrial be declared in his case.
911,JUDGE HOFFMAN,You want me to give him his mistrial?
912,KUNSTLER,You took their black guy and made him a sympathetic character.
913,JUDGE HOFFMAN,I've lived a long time and you're the first person who's ever suggested that I've discriminated against a black man.
914,WEINGLASS,Then let the record show that I'm the second.
915,JUDGE HOFFMAN,(pause) Step back.
916,JUDGE HOFFMAN,I'm issuing an order declaring a mistrial as to the defendant Bobby G. Seale.
917,JUDGE HOFFMAN,"Mr. Seale, you're currently charged with 16 counts of contempt for your repeated displays of disrespect, and you have a pending homicide charge in Connecticut. You are not home free and I doubt you ever will be. We're adjourned until ten a.m. Monday."
918,BAILIFF,All rise. 111.
919,BERNADINE,"Conspiracy office, how can I help you?"
920,BERNADINE,"(into the phone) No, sir, I'm a white woman. (listens) Yeah, I've slept with several in my life so far and on balance I'd have to say yes, it is better and to tell you the truth, I think that's a big part of what's got you worked up."
921,WEINGLASS,Hang up the phone.
922,BERNADINE,"(into the phone) It's not even so much that it's bigger, it's just better, you know what I mean?"
923,WEINGLASS,Hang up the phone.
924,WEINGLASS,Was that a parting gift for Bobby?
925,BERNADINE,"No, that was just for me. 112."
926,JERRY,(to TOM) Why the fuck did you stand up?
927,TOM,I was just--it was a reflex.
928,RENNIE,He was respecting the institution.
929,TOM,And I don't know what good it does to insult the judge. And it was in view of the jury. And the press. And Foran and Schultz who'll be recommending sentencing if we're convicted.
930,ABBIE,"It's a revolution, Tom. We may have to hurt somebody's feelings."
931,RENNIE,(pause) So...we have this list. I was thinking maybe Monday morning we could read the names into the record.
932,TOM,Jesus--
933,RENNIE,As a way of saying--
934,TOM,As a way of saying what?
935,RENNIE,"That whatever we're facing, you know, is peanuts compared to what these guys--"
936,TOM,He's the one who's gonna sentence us. (MORE) 113.
937,TOM,The judge gets to decide what we're facing. It's a goddam trial.
938,ABBIE,A political trial.
939,TOM,"No, we were arrested for--the law doesn't recognize political--"
940,ABBIE,"We weren't arrested, we were chosen. Lee, John, have you guys asked yourselves what you're doing here?"
941,WEINER,Every day.
942,ABBIE,"You're a give-back. They give the jury a couple of guys they can acquit and feel better about finding the rest us guilty. Lenny, am I wrong?"
943,WEINGLASS,No.
944,FROINES,Our role in history is that we made it easier to convict our friends? Lee?
945,ABBIE,"They're gonna find us guilty of ""I just don't like you.” That's why Bill won't put any of us on the stand."
946,DAVE,"I could take the stand, I'm easy for them to like. I'm literally a Boy Scout troop leader."
947,KUNSTLER,You're a conscientious objector.
948,DAVE,A lot of people are conscientious-- 114.
949,RENNIE,That thing. Remember? Outgoing cabinet members are supposed to resign as a courtesy but Ramsey Clark didn't tender his resignation until an hour--
950,JERRY,"Yeah, I read Mitchell had a fit about that. (to WEINGLASS) Did you read about that? (beat) Lenny?"
951,JERRY,(beat) Bill?
952,KUNSTLER,He was never even on our witness list.
953,TOM,Who?
954,KUNSTLER,The first witness you'd put on the stand...if this was a political trial. (calling) Bernadine!
955,BERNADINE,Yeah.
956,KUNSTLER,My office needs to find Ramsey Clark.
957,ABBIE,William Kunstler just showed up.
958,KUNSTLER,Lenny.
959,WEINGLASS,"Maybe--I don't know, does he have a Secret Service detail?"
960,KUNSTLER,No. They're here for us.
961,KUNSTLER,"He was the Attorney General, what do we do, we just ring the doorbell?"
962,WEINGLASS,"Yeah, I guess so."
963,KUNSTLER,You want to do it?
964,TOM,Just ring the damn--
965,KUNSTLER,It's a nice house.
966,WEINGLASS,Yeah. 117.
967,KUNSTLER,"(pause) What would you call this, Tudor or Colonial?"
968,KUNSTLER,"Good morning, I'm Bill Kunstler. Mr. Clark is expecting us."
969,JANE,Come in.
970,JANE,He's in his study at the end of the hall. Can I get anyone coffee?
971,KUNSTLER,"I'll tell you, ma'am, that sounds great."
972,WEINGLASS,"Nothing for me, thank you."
973,JANE,The end of the hall.
974,JANE,Mr. Hayden?
975,JANE,I read in the paper you were the only one who stood for the judge after what he did to Bobby.
976,TOM,Oh. That was a mistake. It was a reflex and--
977,KUNSTLER,Tom? 118.
978,TOM,Yeah.
979,CLARK,"Hey, Bill, Ramsey Clark."
980,KUNSTLER,"Pleased to meet you, sir, this is Leonard Weinglass."
981,CLARK,(shaking hands) Mr. Weinglass.
982,KUNSTLER,And Tom Hayden.
983,CLARK,"I know who Tom Hayden is, the FBI used to work for me. These two men are senior deputies with the Justice Department--Mr. Calley and Mr. Howard."
984,KUNSTLER,I don't know what these men are doing here.
985,CLARK,I invited them.
986,KUNSTLER,(pause) You invited them?
987,CLARK,I don't want any appearance of impropriety.
988,KUNSTLER,There isn't any impropriety. 119.
989,CLARK,And now there are witnesses to that.
990,KUNSTLER,"(pause) Sir, these men are going to call Schultz and Foran as soon as we're done here."
991,CLARK,"Don't be ridiculous, they've already called Schultz and Foran and they're gonna call John Mitchell as soon as we're done here. Ask what you want to ask."
992,KUNSTLER,In front of them?
993,CLARK,Mm-hm.
994,KUNSTLER,"(pause) Alright. Mr. Clark, while you were the Attorney General for President Johnson, was there ever a discussion with the White House about seeking indictments against my clients?"
995,HOWARD,He can't answer that.
996,KUNSTLER,Why not?
997,HOWARD,It's against the law.
998,WEINGLASS,That's an overly broad interpretation of the law.
999,KUNSTLER,"That's Lenny's way of saying you're criminally full of shit, Deputy Howard. 120."
1000,HOWARD,Sir--
1001,KUNSTLER,"And I'll tell you what--We've dealt with jury tampering, wire tapping, a defendant who was literally gagged and a judge who's been handing down rulings from the bench that would be considered wrong in Honduras!--so I'm less interested in the law than I was when this trial began."
1002,HOWARD,"Whether you like the law or not, as a former A.G. he's protected by it."
1003,KUNSTLER,"No, you're protected by it-- (to CLARK) --and due respect, sir, I can subpoena you."
1004,HOWARD,Find a judge in this circuit who'll sign that subpoena.
1005,CLARK,He's right. And taking the stand voluntarily would be a big risk for me.
1006,KUNSTLER,"Again, due respect, but my clients take a much bigger risk when they--"
1007,CLARK,What took you so long?
1008,KUNSTLER,"(beat) --when they stand up against enormous power they can't see and-- I'm sorry, what took me so long to do what?"
1009,CLARK,To realize I'm your star witness?
1010,KUNSTLER,"(beat) Well...we were...remarking on that ourselves, but--"
1011,CLARK,Bill--
1012,HOWARD,He can't testify.
1013,CLARK,"I'm in private practice now and if John Mitchell wants to cut me in half, he can and he will."
1014,TOM,"You have to find--Sir, you have to find some courage now and"
1015,CLARK,"Find some courage, yeah."
1016,TOM,Yes--You have to find some courage and--
1017,WEINGLASS,(holding a hand up) Tom.
1018,CLARK,"That's what these two men came to tell me. That if John Mitchell wants to cut me in half, he can and he will. So I wanted them here in the room when I said--When do you want me in court?"
1019,HOWARD,Mr. Clark--
1020,KUNSTLER,I'm sorry?
1021,CLARK,"Swear me in, Bill."
1022,HOWARD,"It's against the law for you to testify, Ramsey, it's that simple. 122."
1023,CLARK,It's General Clark and arrest me or shut the fuck up. (to TOM--simply) Found it.
1024,KUNSTLER,The defense calls Ramsey Clark.
1025,SCHULTZ,"Your Honor, the People move to disallow this witness."
1026,JUDGE HOFFMAN,I'd like the marshals to take the jury from the room.
1027,JUDGE HOFFMAN,Mr. Schultz?
1028,SCHULTZ,The Code of Federal Regulations mandates that the disclosure of Justice Department material is prohibited without prior knowledge of the Attorney General--plainly meaning the sitting Attorney General--who is John Mitchell who has specifically denied his approval.
1029,WEINGLASS,"Judge, the rule refers to very specific kinds of documents and information. If the regulation was interpreted as Mr. Schultz is asking it to be, nobody in the federal government would ever be able to testify in a trial after leaving their job. 123."
1030,JUDGE HOFFMAN,I think the government is at least justified in asking the defense to demonstrate by voir dire the testimony it expects to illicit from the witness.
1031,KUNSTLER,You'd like us to question the witness outside the presence of the jury?
1032,JUDGE HOFFMAN,"If I find any of the testimony relevant I'll call the jury back in to hear it. (pause) Take it or leave it, Mr. Kunstler."
1033,KUNSTLER,Defense calls Ramsey Clark.
1034,BAILIFF,State your name.
1035,CLARK,William Ramsey Clark.
1036,BAILIFF,"Do you swear that the testimony you give will be the truth, the whole truth and nothing but the truth?"
1037,CLARK,I do.
1038,KUNSTLER,"Mr. Clark, what was your occupation in the summer of 1968?"
1039,CLARK,I was Attorney General of the United States.
1040,KUNSTLER,You were appointed by President Johnson. 124.
1041,JUDGE HOFFMAN,"(beat) Excuse me, sir?"
1042,CLARK,The president isn't a client of the Attorney General. I'm happy to answer.
1043,SCHULTZ,"Your Honor, I don't--hearing from the witness on this point is highly irregular."
1044,JUDGE HOFFMAN,"(pause) Well gentlemen, I'm...This is my courtroom but the witness is the former--he's--and he's just stated his willingness, you know--so for the purposes of voir dire I'll hear the answer."
1045,CLARK,The President asked me if I intended to seek any indictments related to the riots the previous month in Chicago.
1046,KUNSTLER,And what did you tell him?
1047,CLARK,I told him we wouldn't be seeking indictments.
1048,KUNSTLER,Can you tell us why?
1049,CLARK,An investigation by our criminal division led to the clear conclusion that the riots were started by the Chicago Police Department.
1050,SCHULTZ,And the current Justice Department-- the only one that matters--came to a new conclu--
1051,KUNSTLER,And therefore the motivation of the prosecution is now called into--
1052,SCHULTZ,The motivation of the prosecution isn't an issue in a courtroom.
1053,KUNSTLER,Not any courtroom I've ever been in except this one!
1054,FORAN,Object!
1055,JUDGE HOFFMAN,"Mr. Kunstler, do you have any further examination that will demonstrate that this witness will make a material contribution or should I ask him to step down?"
1056,KUNSTLER,You've ruled? You're not going to let the jury hear his testimony?
1057,JUDGE HOFFMAN,"Not unless you can demonstrate to me, which you have not thus far done, that this witness-"
1058,KUNSTLER,Yes sir.
1059,KUNSTLER,(quietly) Are you any good?
1060,JUDGE HOFFMAN,Are you addressing the Court Reporter?
1061,KUNSTLER,(quietly) Keep up with us.. 128.
1062,JUDGE HOFFMAN,Mr. Kunstler.
1063,KUNSTLER,(to CLARK) Is this prosecution politically motivated?
1064,SCHULTZ,Object!
1065,CLARK,Yes.
1066,KUNSTLER,President Nixon inherited an unpopular war?
1067,CLARK,Yes.
1068,JUDGE HOFFMAN,"Step down please, Mr. Clark."
1069,CLARK,And your clients are making it more unpopular every day.
1070,KUNSTLER,"The administration's paranoid about the SDS, the MOBE, the New Left?"
1071,JUDGE HOFFMAN,"Mr. Clark, please. (beat) Please, I'll be forced to find you in Contempt. You understand."
1072,CLARK,"(pause) I do, Your Honor."
1073,KUNSTLER,"(pause) Thank you, sir."
1074,JUDGE HOFFMAN,You may step down.
1075,KUNSTLER,"Your Honor, when the jury returns, will they be informed that the defense had called the former Attorney General but that the Court ruled he couldn't testify?"
1076,JUDGE HOFFMAN,"No, that motion will be denied."
1077,JUDGE HOFFMAN,Cite Mr. Kunstler with his third count of Contempt.
1078,DAVE,(quietly) You're a thug.
1079,JUDGE HOFFMAN,Did one of the defendants speak?
1080,DAVE,(standing) I did. I said you're a thug and you are.
1081,TOM,(quietly) Dave--
1082,JUDGE HOFFMAN,"Please sit, Mr. Dellinger."
1083,DAVE,"If we're guilty, why not give us a trial? If we're--"
1084,JUDGE HOFFMAN,"Marshals, seat the defendant."
1085,DAVE,"If we're guilty, as you clearly decided--"
1086,JUDGE HOFFMAN,Watch yourself.
1087,DAVE,--decided we were a long time ago-- (to a MARSHAL) You don't need to grab my arm. (MORE) 130.
1088,DAVE,"(to JUDGE HOFFMAN) If we're guilty, then why not give us a trial? I've sat here for six months and watched you-- (to a MARSHAL) I'm asking you not to grab--"
1089,JUDGE HOFFMAN,Take him outa here. Lock him up!
1090,DAVE,(calling) I hit him. I'm sorry.
1091,JERRY,There's only one thing--one thing to do. Solidarity with Dave. Tomorrow we go into court and get ourselves arrested.
1092,TOM,We're already arrested.
1093,JERRY,(pause) Is Bill talking to you about taking the stand? (beat) (MORE) 131.
1094,JERRY,Some of the press guys are saying Bill's been talking to you about taking the stand.
1095,TOM,He's been talking to me about it.
1096,JERRY,He thinks you might get the crowd worked up with a position paper?
1097,TOM,Maybe he thinks I won't try to get the crowd worked up at all. Maybe he thinks there are jurors who've relied on the safety of the police and are put off when someone calls them pigs. Or maybe he just wants a witness who dresses like a grown man.
1098,JERRY,The cops in this city in the summer of 1968 were pigs.
1099,TOM,I wonder how many of them have kids in Vietnam.
1100,JERRY,"(to ABBIE) He's gonna take the stand, not you? (beat) We're okay with that?"
1101,JERRY,Abbie!
1102,ABBIE,(to TOM) What did you mean the last thing I want is to end the war?
1103,TOM,(long pause) What? 132.
1104,TOM,Mm-hm.
1105,ABBIE,"And winning elections, that's the first thing on your wish list? Equality, justice, education, poverty and progress--they're second?"
1106,TOM,If we don't win elections it doesn't matter what's second and it's astonishing that someone still has to explain that to you.
1107,RENNIE,"(pause) Okay, so Jerry was talking about--"
1108,ABBIE,(quietly) We don't have any money.
1109,TOM,I'm sorry?
1110,ABBIE,"We don't have any money. So I stage stunts and cameras come, microphones come. And it's astonishing that someone still has to explain that to you."
1111,TOM,You're trading a cow for magic beans.
1112,JERRY,That ended up working.
1113,TOM,What?
1114,JERRY,"The magic beans. There was a giant up there. I can't remember what happened after that, the little boy may have gotten eaten. 134."
1115,FROINES,"No, the giant turned out to be nice."
1116,JERRY,Are you sure?
1117,FROINES,No.
1118,WEINER,It's almost hard to believe the seven of us weren't able to end a war.
1119,ABBIE,(to TOM) Lemme ask you something.
1120,RENNIE,You guys should just shake hands.
1121,ABBIE,You think Chicago would've gone differently if Kennedy got the nomination?
1122,TOM,"Do I think-- (laughs a little) Yes, it--yes. The Irish guys would have sat down with Daley and--yes."
1123,ABBIE,I think so too.
1124,TOM,Yeah.
1125,ABBIE,"That's why I was wondering--weren't you just a little bit happy when the bullet ripped through his head? (beat) No Chicago, no Tom Hayden."
1126,TOM,I WAS ONE OF HIS PALLBEARERS!
