Response number,Speaker,Content
1127,ABBIE,"(pushing him off) That's right! (beat) We're not going to jail because of what we did, we're going to jail because of who we are. Think about that the next time you shrug off cultural revolution. We define winning differently you and me."
1128,ABBIE,"Bill, you shoulda seen it. Tom tried to beat me up but through sheer of force of intellectual superiority--"
1129,KUNSTLER,Stop talking. (beat) Just stop talking.
1130,KUNSTLER,Foran's office turned this over tonight in discovery. It was given to them by somebody in the crowd.
1131,KUNSTLER,"No foul play, there are affidavits, they really did just get this."
1132,TOM,What's on the tape?
1133,KUNSTLER,The sound of you starting the Chicago riot.
1134,TOM,(pause) What?
1135,KUNSTLER,Somebody had a tape recorder at the band shell. (MORE) 136.
1136,TOM,Sure. I'll show you what my answers'll sound like.
1137,DAVE,They called him a radical. They called him a criminal. They called him un-American.
1138,TOM,"First of all, it turned out the guy climbing the flagpole was a kid."
1139,KUNSTLER,It seems like you guys attract an awful lot of underage minors.
1140,TOM,(to WEINGLASS) You want to object?
1141,WEINGLASS,Objection.
1142,KUNSTLER,Overruled.
1143,TOM,We attract the people who have the most to lose by this war continuing.
1144,KUNSTLER,I'm glad you brought that up. Did you serve? 138.
1145,TOM,I wasn't drafted. I didn't try to evade the--I had a high number.
1146,KUNSTLER,But you didn't enlist.
1147,TOM,"I did not volunteer to kill Vietnamese people, no."
1148,KUNSTLER,"You testified that you saw at least six policemen start to go after the man--sorry, kid--who was climbing the flagpole."
1149,TOM,Yes.
1150,KUNSTLER,It was dark and you were a hundred yards away. Do you have telescopic night vision?
1151,TOM,There were floodlights.
1152,DAVE,"And when they called him anti- American. He said, ""No. That ignominious distinction goes to those who mouth American values--"
1153,DAVE,--while breaking America's heart.”
1154,RENNIE,(shouting) Hey! It's alright! He's a kid! We'll get him down!
1155,DAVE,I'd like to introduce you now to Carl Oglesby of the SDS.
1156,TOM,(to himself) Shit.
1157,KUNSTLER,And?
1158,TOM,The police were shoving Rennie away.
1159,OFFICER,This doesn't concern you!
1160,RENNIE,Just leave the kid alone! He'll come down!
1161,OFFICER #2,I know who you are! Step back!
1162,TOM,Rennie was just trying to get the police off of the kid.
1163,KUNSTLER,Get the police off of the kid.
1164,TOM,Yes.
1165,KUNSTLER,How?
1166,TOM,He was--
1167,KUNSTLER,--grabbing them? 140.
1168,RENNIE,Jesus!
1169,TOM,Outa nowhere--
1170,TOM,It was six armed police officers versus Rennie Davis and a pocket protector so I can understand that response.
1171,KUNSTLER,"How 'bout your response. Let's press ""Play”."
1172,FROINES,"I'd like to say to the police back there that we have--we're allowed to be here, we have a permit for-- we need medics back there. 141."
1173,KUNSTLER,Dellinger tried to stop you from saying what you were about to say to the crowd.
1174,TOM,Rennie's been beaten.
1175,DAVE,We can--listen to me--we can still get everybody out of here safely.
1176,TOM,No we can't.
1177,DAVE,Tell 'em to stay calm.
1178,TOM,No.
1179,DAVE,They'll listen to you.
1180,KUNSTLER,Did you tell 'em to stay calm?
1181,TOM,Rennie Davis has just been beaten by the police! Rennie's skull has been cracked open. 142.
1182,KUNSTLER,Did you tell your crowd to stay calm or did you--
1183,TOM,Bill--
1184,KUNSTLER,"I'm Richard Schultz and John Mitchell told me to win, Tom. Did you tell your crowd to stay calm or did you say--"
1185,TOM,Yes. Absolutely. If blood is going to flow--
1186,TOM,(shouting into the microphone) --let it flow all over the city!
1187,DAVE,Goddammit Tom!
1188,TOM,"(into the microphone) If gas is going to be used, let it come down all over Chicago! We're going to the Convention!"
1189,TOM,Let's get on the street! Get on the street!
1190,KUNSTLER,"""If blood is going to flow, let it flow all over the city.” Was that an order to start a peaceful demonstration? 143."
1191,KUNSTLER,"Once you'd had a moment to settle down, did you try top stop people?"
1192,KUNSTLER,You didn't try to stop anyone.
1193,TOM,No.
1194,TOM,(shouting) The bridges! Head to the bridges! The bridges! 144.
1195,KUNSTLER,You were the one who told people to go to the footbridges.
1196,TOM,The ones who were able to make it out of the park without getting arrested or maimed.
1197,KUNSTLER,"And those people, the ones you sent to the footbridges, did they know what was waiting for them on the other side?"
1198,KUNSTLER,All access to the convention was blocked.
1199,TOM,By an armored division. 145.
1200,KUNSTLER,"Of the Illinois National Guard, they're the good guys."
1201,TOM,"Jeeps fitted with concertina wire called Daley Dozers, and when did I stop being one of the good guys?"
1202,KUNSTLER,Let's find out. Were glass bottles being thrown at the police?
1203,DAVE,"Shit, no!"
1204,DAVE,(shouting) Don't throw anything! Drop the bottles! Don't throw anything!
1205,TOM,Some people threw bottles. Dave was the one trying to shut it down. They were frustrated--all three footbridges were--
1206,KUNSTLER,"You, Abbie, Jerry and 11 others eluded the police."
1207,TOM,"I wouldn't say we eluded them, I'd say we were fleeing from them."
1208,KUNSTLER,You found an unguarded bridge. 146.
1209,ABBIE,Now here's where things got weird.
1210,KUNSTLER,"You, Abbie, Jerry and 11 others found the only way to the convention."
1211,ABBIE,"In the lobby of the Hilton, right next to the Convention Center, is a bar called the Haymarket Tavern. The Haymarket Tavern is a watering hole for Chicago's political class and their hookers. And the place was packed to watch Humphrey getting the nomination a mile away."
1212,DELEGATE,"Mr. Chairman, the great state of Ohio, the Buckeye State--"
1213,PATRONS,(toasting) The Buckeye State! 147.
1214,ABBIE,One side of the Haymarket Tavern is a huge picture window with smoked glass. You can't see inside from the street.
1215,KUNSTLER,"You made it through the riot police, the tear gas, the national guard and you're in sight of the Convention Center--"
1216,TOM,Where we got trapped.
1217,KUNSTLER,What's another word for trapped?
1218,TOM,We were trapped between the window and the police.
1219,KUNSTLER,"What's another word for trapped? (beat) ""Caught”, right? 148."
1220,ABBIE,"Inside the bar it's like the 60's never happened. Outside the bar, the 60's were being performed for anyone who looked out the window."
1221,BAR PATRON #1,Does anyone know what a buckeye is?
1222,WOMAN,(trying to get his attention) Hey.
1223,BAR PATRON #2,A buckeye?
1224,BAR PATRON #1,Yeah.
1225,WOMAN,Am I the only one who sees what's going on out there?
1226,BAR PATRON #2,A buckeye is a nut. A poisonous nut.
1227,ABBIE,And we see a cop do something you don't ever want to see a cop do. 149.
1228,KUNSTLER,"All those people, how come you and Abbie and Jerry are the only ones who saw them do that?"
1229,TOM,I don't know. It was dark. People were scared.
1230,ABBIE,60's outside the bar. 50's inside the bar. And then...? An unnecessary metaphor.
1231,BAR PATRON #2,(over the noise) It's a nut?
1232,BAR PATRON #1,What?
1233,BAR PATRON #2,(louder) A nut!
1234,KUNSTLER,Were you resisting arrest? 150.
1235,TOM,They pushed us through the window.
1236,KUNSTLER,You overrun the riot police--
1237,KUNSTLER,"--make it past the tear gas,        (simultaneously) make it past the national        Which is more than Rennie can guard, find an open bridge,      say! Over 400 people admitted you can practically reach        to area hospitals with severe your hand out and touch the      injuries! They had armored convention and you gave          vehicles! Bayonets! They took yourself up peacefully?          off their name tags and badges! We were trying to protest peacefully at the fucking convention!"
1238,POLICEMAN,Hands behind your back.
1239,TOM,(pause) Yeah.
1240,KUNSTLER,"Who started the riot, Tom?"
1241,TOM,"(pause) ""Our”."
1242,KUNSTLER,(pause) What? 151.
1243,TOM,"(beat) ""Our”. ""Our blood”."
1244,ABBIE,"(pause) ""Our” blood. If ""our” blood is going to flow--you meant to say, ""If 'our' blood is going to flow, let it flow all over the city.” You didn't mean the cops, you were saying if they're going to beat us up then everyone should see it."
1245,KUNSTLER,(quietly) Jesus Christ.
1246,ABBIE,"You do this-- (to KUNSTLER) He does this, it's a pattern. Read his portion of the Port Huron Statement. He implies possessive pronouns and he uses vague noun modifiers."
1247,TOM,(pause) You read the Port Huron Statement?
1248,ABBIE,I've read everything you've published.
1249,TOM,I didn't know that.
1250,ABBIE,You're a talented guy. Except for the possessive pronouns and the vague--
1251,TOM,I know.
1252,TOM,(to KUNSTLER) Put Abbie on the stand instead.
1253,JUDGE HOFFMAN,Would you state your full name for the record please.
1254,ABBIE,It's Abbie.
1255,JUDGE HOFFMAN,Your last name.
1256,ABBIE,My grandfather's name was Shaboysnakoff but he was a Russian Jew protesting anti-semitism so he was assigned a name that would sound like yours.
1257,JUDGE HOFFMAN,What is your date of birth?
1258,ABBIE,"Psychologically, 1960."
1259,JUDGE HOFFMAN,What were you doing until 1960?
1260,ABBIE,Nothing really. It's called an American education.
1261,JUDGE HOFFMAN,Why don't we just proceed with the testimony.
1262,ABBIE,Sure.
1263,KUNSTLER,Do you know why you're on trial here?
1264,ABBIE,We carried certain ideas across state lines. Not machine guns or drugs or little girls. (MORE) 153.
1265,ABBIE,"When we crossed from New York to New Jersey to Pennsylvania to Ohio to Illinois, we had certain ideas. And for that, we were gassed, beaten, arrested and put on trial. In 1861, Lincoln said in his Inaugural address that, ""When the people shall grow weary of their Constitutional right to amend their government, they shall exert their revolutionary right to dismember and overthrow that government.” And if Lincoln had given that speech in Lincoln Park last summer he'd be on trial with the rest of us."
1266,KUNSTLER,How do you overthrow and dismember a government peacefully?
1267,ABBIE,In this country we do it every four years.
1268,KUNSTLER,That's all.
1269,SCHULTZ,So Chicago was just a massive voter registration drive.
1270,ABBIE,(laughs) Yeah.
1271,SCHULTZ,Did you hear the tape that was played in court of Mr. Hayden at the bandshell?
1272,ABBIE,Yes.
1273,SCHULTZ,You heard the tape?
1274,ABBIE,Yes. 154.
1275,SCHULTZ,That your plans for the convention were specifically designed to draw the police into a confrontation.
1276,ABBIE,If I'd known it was going to be the first wish of mine that came true I would've aimed higher.
1277,SCHULTZ,It's a yes or no question. When you came to Chicago were you hoping for a confrontation with the police?
1278,SCHULTZ,I'm concerned that you have to think about it.
1279,ABBIE,"Gimme me a moment, would you friend? I've never been on trial for my thoughts before."
1280,BAILIFF,All rise.
1281,BAILIFF,"69 CR 180, United States of America versus David Dellinger et al. 157."
1282,JUDGE HOFFMAN,The law requires that before sentencing I allow the defendant or defendants to make a statement to the Court. I've advised defense counsel that the Court will allow one defendant to speak for the group and I've been advised that the group has chosen Mr. Hayden. Is that right?
1283,TOM,(standing) Yes sir.
1284,JUDGE HOFFMAN,"In spite of your actions during the convention, you are the one defendant who has shown during this trial, respect for this court and for this country and remorse for your actions. I truly believe--I mean this--I truly believe that one day you could be a very productive part of our system. I'd like you to make your statement brief and without any political content of any kind. If you make your statement brief, if you make it respectful, remorseful and to the point, I will look favorably upon that when administering my sentence. Do you understand what I just said?"
1285,JUDGE HOFFMAN,Mr. Hayden?
1286,TOM,Yes. (pause) You'll look favorably in sentencing.
1287,JUDGE HOFFMAN,Yes.
1288,TOM,(pause) If I make my statement respectful and remorseful. 158.
1289,JUDGE HOFFMAN,Yes.
1290,TOM,"And I'm sorry, Your Honor, what was the third one?"
1291,JUDGE HOFFMAN,Brief.
1292,TOM,Brief. If I do those things...then my government will look favorably on me.
1293,JUDGE HOFFMAN,You understand?
1294,TOM,Yes sir.
1295,JUDGE HOFFMAN,Please begin.
1296,TOM,Okay.
1297,TOM,"Your Honor, since the day this trial began, four-thousand seven hundred and fifty-two U.S. troops have been killed in Vietnam. (pause) And the following are their names."
1298,TOM,"Corporal Kenneth Joe Auston, 19 years old. Specialist Billy Francis Dodd, 21 years old."
1299,JUDGE HOFFMAN,"There will be--Mr. Kunstler, he will not read four-thousand five- hundred names into the record. There will be quiet in the gallery! Mr. Hayden!"
1300,TOM,"Staff Sergeant David Cruz Chavez, 31 years old. Corporal Philip Lawrence Jewell, 21 years old."
1301,FORAN,What are you doing?
1302,SCHULTZ,"Respect for the fallen. (beat) Show 'em some respect, sir."
1303,CROWD,THE WHOLE WORLD IS WATCHING!
